{
  "contract_version": "0.1.0",
  "usage_id": "use_syn_turn_a",
  "session_id": "ses_syn_customer_a",
  "turn_id": "3d1c6e2a-4b7f-4c11-9a20-0c8d1e2f3a4b",
  "provider": "none",
  "model_id": "unavailable",
  "prompt_version": "rakan.system.0",
  "input_tokens": 0,
  "output_tokens": 0,
  "latency_ms": 2,
  "cost_estimate_minor": null,
  "outcome": "error",
  "created_at": "2026-09-14T10:05:01Z"
}
